Authors,Document Title,Year,Source title,Volume,Issue,Art. No.,Page start,Page end,label,Other predictin,Page count,Cited by,DOI,PDF Link,Affiliations,Authors with affiliations,Abstract,Author Keywords,Document Type,Source,EID
"Lenhard J., Wirtz G.",Portability of executable service-oriented processes: metrics and validation,2016,Service Oriented Computing and Applications,10,4,,391,411,no,,,,10.1007/s11761-016-0195-4,https://www.scopus.com/inward/record.uri?eid=2-s2.0-84978083260&doi=10.1007%2fs11761-016-0195-4&partnerID=40&md5=7ea37d00ef3718627fb172b8630044ca,"Department of Mathematics and Computer Science, Karlstad University, Karlstad, Sweden; Distributed Systems Group, University of Bamberg, Bamberg, Germany","Lenhard, J., Department of Mathematics and Computer Science, Karlstad University, Karlstad, Sweden; Wirtz, G., Distributed Systems Group, University of Bamberg, Bamberg, Germany","A key promise of process languages based on open standards, such as the Web Services Business Process Execution Language, is the avoidance of vendor lock-in through the portability of processes among runtime environments. Despite the fact that today various runtimes claim to support this language, every runtime implements a different subset, thus hampering portability and locking in their users. It is our intention to improve this situation by enabling the measurement of the portability of executable service-oriented processes. This helps developers to assess their implementations and to decide if it is feasible to invest in the effort of porting a process to another runtime. In this paper, we define several software quality metrics that quantify the degree of portability of an executable, service-oriented process from different viewpoints. When integrated into a development environment, such metrics can help to improve the portability of the outcome. We validate the metrics theoretically with respect to measurement theory and construct validity using two validation frameworks. The validation is complemented with an empirical evaluation of the metrics using a large set of processes coming from several process libraries. å© 2016, Springer-Verlag London.",Metrics; Portability; Process; SOA; Software quality,Article,Scopus,2-s2.0-84978083260
Lemmens S.,Cost engineering techniques and their applicability for cost estimation of organic rankine cycle systems,2016,Energies,9,7,485,,,no,,,1,10.3390/en9070485,https://www.scopus.com/inward/record.uri?eid=2-s2.0-84978083369&doi=10.3390%2fen9070485&partnerID=40&md5=3dddf7ba5aed3676f4038ad571a1a96d,"Department Engineering Management, University of Antwerp, Prinsstraat 13, Antwerp, Belgium","Lemmens, S., Department Engineering Management, University of Antwerp, Prinsstraat 13, Antwerp, Belgium","The potential of organic Rankine cycle (ORC) systems is acknowledged by both considerable research and development efforts and an increasing number of applications. Most research aims at improving ORC systems through technical performance optimization of various cycle architectures and working fluids. The assessment and optimization of technical feasibility is at the core of ORC development. Nonetheless, economic feasibility is often decisive when it comes down to considering practical instalments, and therefore an increasing number of publications include an estimate of the costs of the designed ORC system. Various methods are used to estimate ORC costs but the resulting values are rarely discussed with respect to accuracy and validity. The aim of this paper is to provide insight into the methods used to estimate these costs and open the discussion about the interpretation of these results. A review of cost engineering practices shows there has been a long tradition of industrial cost estimation. Several techniques have been developed, but the expected accuracy range of the best techniques used in research varies between 10% and 30%. The quality of the estimates could be improved by establishing up-to-date correlations for the ORC industry in particular. Secondly, the rapidly growing ORC cost literature is briefly reviewed. A graph summarizing the estimated ORC investment costs displays a pattern of decreasing costs for increasing power output. Knowledge on the actual costs of real ORC modules and projects remains scarce. Finally, the investment costs of a known heat recovery ORC system are discussed and the methodologies and accuracies of several approaches are demonstrated using this case as benchmark. The best results are obtained with factorial estimation techniques such as the module costing technique, but the accuracies may diverge by up to +30%. Development of correlations and multiplication factors for ORC technology in particular is likely to improve the quality of the estimates. å© 2016 by the author; licensee MDPI.",Case study; Cost estimate; Heat recovery; Investment costs; Organic Rankine cycle (ORC),Article,Scopus,2-s2.0-84978083369
"Lee H.Y., Kim H.-J.",Cost Estimation of Hybrid System Models in Simulation Based Acquisition,2015,"Proceedings - 2015 4th International Conference on Advanced Information Technology and Sensor Application, AITS 2015",,,7396445,55,58,no,,,,10.1109/AITS.2015.21,https://www.scopus.com/inward/record.uri?eid=2-s2.0-84964579455&doi=10.1109%2fAITS.2015.21&partnerID=40&md5=9a69059d93ae7713eed40b6d362481ae,"Seoul Women's University, South Korea","Lee, H.Y., Seoul Women's University, South Korea; Kim, H.-J., Seoul Women's University, South Korea","While a defense system is being acquired using simulation-based acquisition (SBA), part of the system would be described as hybrid systems that have both discrete and continuous components. Also we need to quantify the benefits of SBA somehow in order to clearly determine them. In this paper we propose a method for cost estimation of hybrid system models that are specified based on a formalism for modeling and simulation. Existing estimation methods designed for discrete or continuous system models cannot be directly applied to the estimation since they leave the interaction between the components out of consideration. On the contrary the proposed method estimates the cost in a 'rough order of magnitude' manner through measuring discrete and continuous factors of a model as well as another factor of their correlation. å© 2015 IEEE.",acquisition modeling and simulation; cost-benefit analysis; discrete event system specification; hybrid systems; simulation-based acquisition,Conference Paper,Scopus,2-s2.0-84964579455
"Lee B., Kim M.",A CU-Level Rate and Distortion Estimation Scheme for RDO of Hardware-Friendly HEVC Encoders Using Low-Complexity Integer DCTs,2016,IEEE Transactions on Image Processing,25,8,7488286,3787,3800,no,,,,10.1109/TIP.2016.2579559,https://www.scopus.com/inward/record.uri?eid=2-s2.0-84979074110&doi=10.1109%2fTIP.2016.2579559&partnerID=40&md5=1bb5d62cb022019987c2959e9f32369b,"School of Electrical Engineering, Korea Advanced Institute of Science and Technology, Daejeon, South Korea","Lee, B., School of Electrical Engineering, Korea Advanced Institute of Science and Technology, Daejeon, South Korea; Kim, M., School of Electrical Engineering, Korea Advanced Institute of Science and Technology, Daejeon, South Korea","In this paper, a low complexity coding unit (CU)-level rate and distortion estimation scheme is proposed for High Efficiency Video Coding (HEVC) hardware-friendly implementation where a Walsh-Hadamard transform (WHT)-based low-complexity integer discrete cosine transform (DCT) is employed for distortion estimation. Since HEVC adopts quadtree structures of coding blocks with hierarchical coding depths, it becomes more difficult to estimate accurate rate and distortion values without actually performing transform, quantization, inverse transform, de-quantization, and entropy coding. Furthermore, DCT for rate-distortion optimization (RDO) is computationally high, because it requires a number of multiplication and addition operations for various transform block sizes of 4-, 8-, 16-, and 32-orders and requires recursive computations to decide the optimal depths of CU or transform unit. Therefore, full RDO-based encoding is highly complex, especially for low-power implementation of HEVC encoders. In this paper, a rate and distortion estimation scheme is proposed in CU levels based on a low-complexity integer DCT that can be computed in terms of WHT whose coefficients are produced in prediction stages. For rate and distortion estimation in CU levels, two orthogonal matrices of 4ÌÑ 4 and 8ÌÑ 8 , which are applied to WHT that are newly designed in a butterfly structure only with addition and shift operations. By applying the integer DCT based on the WHT and newly designed transforms in each CU block, the texture rate can precisely be estimated after quantization using the number of non-zero quantized coefficients and the distortion can also be precisely estimated in transform domain without de-quantization and inverse transform required. In addition, a non-texture rate estimation is proposed by using a pseudoentropy code to obtain accurate total rate estimates. The proposed rate and the distortion estimation scheme can effectively be used for HW-friendly implementation of HEVC encoders with 9.8% loss over HEVC full RDO, which much less than 20.3% and 30.2% loss of a conventional approach and Hadamard-only scheme, respectively. å© 1992-2012 IEEE.",distortion estimation; Hadamard transform; HEVC; integer DCT; rate estimation; Rate-distortion optimization,Article,Scopus,2-s2.0-84979074110
"Langhammer M., Shahbazian A., Medvidovic N., Reussner R.H.",Automated extraction of rich software models from limited system information,2016,"Proceedings - 2016 13th Working IEEE/IFIP Conference on Software Architecture, WICSA 2016",,,7516816,99,108,no,,,,10.1109/WICSA.2016.35,https://www.scopus.com/inward/record.uri?eid=2-s2.0-84983347731&doi=10.1109%2fWICSA.2016.35&partnerID=40&md5=b589aa480b6fdaec14fd1bfd20755863,"Karlsruhe Institute of Technology, Karlsruhe, Germany; Computer Science Department, University of Southern California, Los Angeles, CA, United States","Langhammer, M., Karlsruhe Institute of Technology, Karlsruhe, Germany; Shahbazian, A., Computer Science Department, University of Southern California, Los Angeles, CA, United States; Medvidovic, N., Computer Science Department, University of Southern California, Los Angeles, CA, United States; Reussner, R.H., Karlsruhe Institute of Technology, Karlsruhe, Germany","Reverse engineering a software system is challenged by the typically very limited information available about existing systems. Useful reverse engineering tasks include recovering a system's architectural, behavioral, and usage models, which can then be leveraged to answer important questions about a system. For example, using such models to analyze and predict a system's non-functional properties would help to efficiently assess the system's current state, planned adaptations, scalability issues, etc. Existing approaches typically only extract a system's static architecture, omitting the dynamic information that is needed for such analyses. The contribution of this paper is an automated technique that extracts a system's static architecture, behavior, and usage models from very limited, but readily available information: source code and test cases. These models can then be fed into known performance, reliability, and cost prediction techniques. We evaluated our approach for accuracy against systems with already established usage models, and observed that our approach finds the correct, but more detailed usage models. We also analyzed 14 open source software systems spanning over 2 million lines of code to evaluate the scalability of our approach. å© 2016 IEEE.",,Conference Paper,Scopus,2-s2.0-84983347731
"Laatikainen G., Mazhelis O., Tyrvainen P.",Cost benefits of flexible hybrid cloud storage: Mitigating volume variation with shorter acquisition cycle,2016,Journal of Systems and Software,122,,,180,201,no,,,,10.1016/j.jss.2016.09.008,https://www.scopus.com/inward/record.uri?eid=2-s2.0-84988643235&doi=10.1016%2fj.jss.2016.09.008&partnerID=40&md5=1246c7a78be1cb00d97617855e3f2e99,"University of Jyvaskyla, Department of Computer Science and Information Systems, P.O. Box 35, FI-40014 University of Jyvaskyla, Finland; University of Jyvaskyla, Agora Center, P.O. Box 35, FI-40014 University of Jyvaskyla, Finland","Laatikainen, G., University of Jyvaskyla, Department of Computer Science and Information Systems, P.O. Box 35, FI-40014 University of Jyvaskyla, Finland; Mazhelis, O., University of Jyvaskyla, Department of Computer Science and Information Systems, P.O. Box 35, FI-40014 University of Jyvaskyla, Finland; Tyrvainen, P., University of Jyvaskyla, Agora Center, P.O. Box 35, FI-40014 University of Jyvaskyla, Finland","Hybrid cloud storage combines cost-effective but inflexible private storage along with flexible but premium-priced public cloud storage. As a form of concurrent sourcing, it offers flexibility and cost benefits to organizations by allowing them to operate at a cost-optimal scale and scope under demand volume uncertainty. However, the extant literature offers limited analytical insight into the effect that the non-stationarity (i.e., variability) and non-determinism (i.e., uncertainty) of the demand volume ‰ÛÒ in other words, the demand variation ‰ÛÒ have on the cost-efficient mix of internal and external sourcing. In this paper, we focus on the reassessment interval ‰ÛÒ that is, the interval at which the organization re-assesses its storage needs and acquires additional resources ‰ÛÒ, as well as on the impacts it has on the optimal mix of sourcing. We introduce an analytical cost model that captures the compound effect of the reassessment interval and volume variation on the cost-efficiency of hybrid cloud storage. The model is analytically investigated and empirically evaluated in simulation studies reflecting real-life scenarios. The results confirm that shortening the reassessment interval allows volume variability to be reduced, yielding a reduction of the overall costs. The overall costs are further reduced if, by shortening the interval, the demand uncertainty is also reduced. å© 2016 Elsevier Inc.",Acquisition interval; Concurrent sourcing; Hybrid cloud storage; Plural governance; Reassessment interval; Volume variation,Article,Scopus,2-s2.0-84988643235
"Kyriklidis C., Dounias G.",Evolutionary computation for resource leveling optimization in project management,2016,Integrated Computer-Aided Engineering,23,2,,173,184,no,,,,10.3233/ICA-150508,https://www.scopus.com/inward/record.uri?eid=2-s2.0-84960948959&doi=10.3233%2fICA-150508&partnerID=40&md5=256fb50e499976d4a06834cab0df5ca0,"Management and Decision Engineering Laboratory (MDE-Lab), Department of Financial and Management Engineering, University of the Aegean, 41 Kountouriotou Street, Chios, Greece","Kyriklidis, C., Management and Decision Engineering Laboratory (MDE-Lab), Department of Financial and Management Engineering, University of the Aegean, 41 Kountouriotou Street, Chios, Greece; Dounias, G., Management and Decision Engineering Laboratory (MDE-Lab), Department of Financial and Management Engineering, University of the Aegean, 41 Kountouriotou Street, Chios, Greece","This paper proposes an evolutionary computation based approach for solving resource leveling optimization problems in project management. In modern management engineering, problems of this kind refer to the optimal handling of available resources in a candidate project and have emerged, as the result of the even increasing needs of project managers in facing project complexity, controlling related budgeting and finances and managing the construction production line. Standard approaches, such as exhaustive or greedy search methodologies, fail to provide near-optimum solutions in feasible time even for small scale problems, whereas intelligent approaches manage to quickly reach high quality near-optimal solutions. In this work, a new genetic algorithm is proposed which investigates the start time of the non-critical activities of a project, in order to optimally allocate its resources. The innovation of the proposed approach is related to certain genetic operations applied like crossover for the improvement of the solution quality from generation to generation. The presentation and performance comparison of all multi-objective functions for resource leveling that are available in literature is another interesting part of this work. Detailed experiments with small and medium size benchmark problems taken from publicly available project data resources produce highly accurate resource profiles. As shown in the experimental results, the proposed methodology proves capable of coping even with large size project management problems without the need to divide the original problem to sub-problems due to complexity. å© 2016 - IOS Press and the author(s). All rights reserved.",Genetic algorithms; Project management; Resource levelling; Time constraint project scheduling,Conference Paper,Scopus,2-s2.0-84960948959
"Kuo R.J., Li P.S.",Taiwanese export trade forecasting using firefly algorithm based K-means algorithm and SVR with wavelet transform,2016,Computers and Industrial Engineering,99,,,153,161,no,,,,10.1016/j.cie.2016.07.012,https://www.scopus.com/inward/record.uri?eid=2-s2.0-84979643086&doi=10.1016%2fj.cie.2016.07.012&partnerID=40&md5=0e35a39fc916f8d1f5b061bfdbdc3c13,"Department of Industrial Management, National Taiwan University of Science and Technology, No. 43, Section 4, Kee-Lung Road, Taipei, Taiwan; AU Optronics Corporation, No. 1 Jhong-Ke Road, Central Taiwan Science Park, Taichung, Taiwan","Kuo, R.J., Department of Industrial Management, National Taiwan University of Science and Technology, No. 43, Section 4, Kee-Lung Road, Taipei, Taiwan; Li, P.S., AU Optronics Corporation, No. 1 Jhong-Ke Road, Central Taiwan Science Park, Taichung, Taiwan","In order to develop a prediction system for export trade value, this study proposes a three-stage forecasting model which integrates wavelet transform, firefly algorithm-based K-means algorithms and firefly algorithm-based support vector regression (SVR). First, wavelet transform is utilized to reduce the noise in data preprocessing. Then, the firefly algorithm-based K-means algorithm is employed for cluster analysis. Finally, a forecasting model is built for each cluster individually. For evaluation, this study compares methods with and without clustering. In addition, both non-wavelet transform and wavelet transform for data preprocessing are investigated. The experimental results indicate that the forecasting algorithm with both wavelet transform and clustering has better performance. Besides, firefly algorithm-based SVR outperforms the other algorithms. å© 2016 Elsevier Ltd",Cluster analysis; Firefly algorithm; Forecasting; Support vector regression; Wavelet transform,Article,Scopus,2-s2.0-84979643086
"Kumar S., Nag R.",An approach for multimedia software size estimation,2016,"Proceedings of the 10th INDIACom; 2016 3rd International Conference on Computing for Sustainable Global Development, INDIACom 2016",,,7724480,1321,1326,no,Size,,,,https://www.scopus.com/inward/record.uri?eid=2-s2.0-84997235977&partnerID=40&md5=e81eaa8583d3be82831cf068b4b29c51,"Sharda University, Greater Noida, India; BIT, Extention Centre, Mesra, Noida, India","Kumar, S., Sharda University, Greater Noida, India; Nag, R., BIT, Extention Centre, Mesra, Noida, India","Although, the Function Point Analysis has offered an idea to estimate the size of software in both planned and existing one [1], use of multimedia technology has provided a different direction for delivering instruction. The interested users in the era of Graphics User Interfaces, are being attracted, gets benefited and have new learning capabilities and this is reason the two-way multimedia training is a process, rather than being termed as a technology. Multimedia software Developer should use suitable methods for designing the package which will not only enhance its capabilities but will also be user friendly. Mixed media projects can be utilized to present data in combined form in a number of ways to energize routes hypermedia strategies with guideline. Great presentations can be made when they depend on psychological targets that create attention on the learning of themes at distinctive levels of appreciation. All media segments, for example, design, sound and video and so forth it adds to learning. While developing multimedia programs, developer should focus mainly on three point; firstly grabbing the user's attention; secondly it should ease the user to find and organize all necessary information and finally to integrate all information into the user's knowledge data bank. All elements like text, graphics icon and audio visual elements need to be utilized at the maximum to create visual appeal and organized in structured program, and thus for the purpose of systematic organization it is convenient to divide the screen into functional areas by the Developers. Class and sequence diagrams were utilized solely for the generation of FP counts [2]. A similar technique for creating automated counts using COSMIC FFP methods likewise depended on UML graphs [3]. But, neither of these strategies measures will be used for the estimation mixed media software the developers. å© 2016 IEEE.",MCAF-Multimedia Complexity Adjustment Factor; MFPA-Multimedia Function Point Analysis; MLI-Level of Impact for Multimedia; MUFP-Multimedia Unadjusted Function Points; MVAF-Value Adjustment Factor for Multimedia,Conference Paper,Scopus,2-s2.0-84997235977
"Kuljaroenwirat N., Seresangtakul P.",Model for predicting cost overrun in small and medium-sized public construction project,2016,"2016 13th International Joint Conference on Computer Science and Software Engineering, JCSSE 2016",,,7748867,,,no,,,,10.1109/JCSSE.2016.7748867,https://www.scopus.com/inward/record.uri?eid=2-s2.0-85006934362&doi=10.1109%2fJCSSE.2016.7748867&partnerID=40&md5=262eaaf9b77879d8e9e2eea5caea1708,"Department of Computer Science, Faculty of Science, Khon Kaen University, Khon Kaen, Thailand","Kuljaroenwirat, N., Department of Computer Science, Faculty of Science, Khon Kaen University, Khon Kaen, Thailand; Seresangtakul, P., Department of Computer Science, Faculty of Science, Khon Kaen University, Khon Kaen, Thailand","Cost overrun is the important issue in the construction industry that gets attention in several countries. This study focuses on affected construction company to examine the cost overrun factors of a public construction project, such as dredge and road. The prediction model for cost overrun in pre-tender phase was developed base on artificial neural networks (ANN), case-based reasoning (CBR), and hybrid ANN-CBR by using actual information collected from the construction contract and experts interviewing. The evaluation results during models development process shown that ANN was more accurate than CBR. On the other hand, the result of each model validated with 12 unseen projects shown that ANN and CBR with factor weights averaged from the best ANN model also have acceptable accuracy. However, CBR is more useful to support constructors' decision, since CBR itself could produce results with similarity score included as the probability percentage. å© 2016 IEEE.",Artificial Neural Network; Case-based reasoning; Cost overrun,Conference Paper,Scopus,2-s2.0-85006934362
"Krishnan S., Wang J., Franklin M.J., Goldberg K., Kraska T.",PrivateClean: Data cleaning and differential privacy,2016,Proceedings of the ACM SIGMOD International Conference on Management of Data,26-Jun-16,,,937,951,no,,,,10.1145/2882903.2915248,https://www.scopus.com/inward/record.uri?eid=2-s2.0-84979656533&doi=10.1145%2f2882903.2915248&partnerID=40&md5=37807da0fcfc77aadc358a1799992906,"UC Berkeley, United States; Simon Fraser University, Canada; Brown University, United States","Krishnan, S., UC Berkeley, United States; Wang, J., Simon Fraser University, Canada; Franklin, M.J., UC Berkeley, United States; Goldberg, K., UC Berkeley, United States; Kraska, T., Brown University, United States","Recent advances in differential privacy make it possible to guarantee user privacy while preserving the main characteristics of the data. However, most differential privacy mechanisms assume that the underlying dataset is clean. This paper explores the link between data cleaning and differential privacy in a framework we call PrivateClean. PrivateClean includes a technique for creating private datasets of numerical and discrete-valued attributes, a formalism for privacy-preserving data cleaning, and techniques for answering sum, count, and avg queries after cleaning. We show: (1) how the degree of privacy affects subsequent aggregate query accuracy, (2) how privacy potentially amplifies certain types of errors in a dataset, and (3) how this analysis can be used to tune the degree of privacy. The key insight is to maintain a bipartite graph relating dirty values to clean values and use this graph to estimate biases due to the interaction between cleaning and privacy. We validate these results on four datasets with a variety of well-studied cleaning techniques including using functional dependencies, outlier filtering, and resolving inconsistent attributes. å© 2016 ACM.",,Conference Paper,Scopus,2-s2.0-84979656533
