Authors,Document Title,Year,Source title,Volume,Issue,Art. No.,Page start,Page end,label,Other predictin,Page count,Cited by,DOI,PDF Link,Affiliations,Authors with affiliations,Abstract,Author Keywords,Document Type,Source,EID
"Cheng M.-Y., Hoang N.-D.",A Self-Adaptive Fuzzy Inference Model Based on Least Squares SVM for Estimating Compressive Strength of Rubberized Concrete,2016,International Journal of Information Technology and Decision Making,15,3,,603,619,no,,,1,10.1142/S0219622016500140,https://www.scopus.com/inward/record.uri?eid=2-s2.0-84963705467&doi=10.1142%2fS0219622016500140&partnerID=40&md5=acfa4a8e289fc5d536d99eb31ec0eae4,"Department of Civil and Construction Engineering, National Taiwan University of Science and Technology, #43, Section 4, Keelung Road, Daan District, Taipei, Taiwan; Institute of Research and Development, Faculty of Civil Engineering, Duy Tan University, P809 - K7/25 Quang Trung, Danang, Viet Nam","Cheng, M.-Y., Department of Civil and Construction Engineering, National Taiwan University of Science and Technology, #43, Section 4, Keelung Road, Daan District, Taipei, Taiwan; Hoang, N.-D., Institute of Research and Development, Faculty of Civil Engineering, Duy Tan University, P809 - K7/25 Quang Trung, Danang, Viet Nam","This paper presents an AI approach named as self-Adaptive fuzzy least squares support vector machines inference model (SFLSIM) for predicting compressive strength of rubberized concrete. The SFLSIM consists of a fuzzification process for converting crisp input data into membership grades and an inference engine which is constructed based on least squares support vector machines (LS-SVM). Moreover, the proposed inference model integrates differential evolution (DE) to adaptively search for the most appropriate profiles of fuzzy membership functions (MFs) as well as the LS-SVM's tuning parameters. In this study, 70 concrete mix samples are utilized to train and test the SFLSIM. According to experimental results, the SFLSIM can achieve a comparatively low MAPE which is less than 2%. å© 2016 World Scientific Publishing Company.",differential evolution; fuzzy logic; least squares support vector machines; Rubberized concrete; strength estimate,Article,Scopus,2-s2.0-84963705467
"Cheng A.-C., Jiang I.H.-R., Jou J.-Y.",Resource-aware functional ECO patch generation,2016,"Proceedings of the 2016 Design, Automation and Test in Europe Conference and Exhibition, DATE 2016",,,7459462,1036,1041,no,,,,,https://www.scopus.com/inward/record.uri?eid=2-s2.0-84973659218&partnerID=40&md5=e49a6524a8ab303165eac8adf5769e47,"Department of Electronics Engineering, National Chiao Tung University, Hsinchu, Taiwan; Department of Electrical Engineering, National Central University, Taoyuan, Taiwan","Cheng, A.-C., Department of Electronics Engineering, National Chiao Tung University, Hsinchu, Taiwan; Jiang, I.H.-R., Department of Electronics Engineering, National Chiao Tung University, Hsinchu, Taiwan; Jou, J.-Y., Department of Electronics Engineering, National Chiao Tung University, Hsinchu, Taiwan, Department of Electrical Engineering, National Central University, Taoyuan, Taiwan","Functional Engineering Change Order (ECO) is necessary for logic rectification at late design stages. Existing works mainly focus on identifying a minimal logic difference between the original netlist and the revised netlist, which is called a patch. The patch is then implemented by technology mapping using spare cells. However, there may be insufficient spare cells around the physical location of the patch, or the wires connecting spare cells are too long, thus causing timing violations and routing congestion. In this paper, we propose a resource-aware functional patch generation approach by gate count and wiring cost estimations. In particular, we estimate the number of spare cells required by a patch and define a cost of wire length on it, which considers the physical location of the patch and a set of nearby spare cells. As a result, the patch with minimal wiring cost instead of minimal size is produced. The experiments are conducted on nine industrial testcases. These testcases reflect real problems faced by designers, and the results show our method is promising. å© 2016 EDAA.",,Conference Paper,Scopus,2-s2.0-84973659218
Chen Y.-S.,A comprehensive identification-evidence based alternative for HIV/AIDS treatment with HAART in the healthcare industries,2016,Computer Methods and Programs in Biomedicine,131,,,111,126,no,,,,10.1016/j.cmpb.2016.04.001,https://www.scopus.com/inward/record.uri?eid=2-s2.0-84963499962&doi=10.1016%2fj.cmpb.2016.04.001&partnerID=40&md5=65bb7569e642d300d9e93a1b4f1a33da,"Department of Information Management, Hwa Hsia University of Technology, 111, Gongzhuan Rd., Zhonghe Dist., New Taipei City, Taiwan","Chen, Y.-S., Department of Information Management, Hwa Hsia University of Technology, 111, Gongzhuan Rd., Zhonghe Dist., New Taipei City, Taiwan","Background and Objective: The HIV/AIDS-related issue has given rise to a priority concern in which potential new therapies are increasingly highlighted to lessen the negative impact of highly active anti-retroviral therapy (HAART) in the healthcare industry. With the motivation of ""medical applications,"" this study focuses on the main advanced feature selection techniques and classification approaches that reflect a new architecture, and a trial to build a hybrid model for interested parties. Methods: This study first uses an integrated linear-nonlinear feature selection technique to identify the determinants influencing HAART medication and utilizes organizations of different condition-attributes to generate a hybrid model based on a rough set classifier to study evolving HIV/AIDS research in order to improve classification performance. Results: The proposed model makes use of a real data set from Taiwan's specialist medical center. The experimental results show that the proposed model yields a satisfactory result that is superior to the listed methods, and the core condition-attributes PVL, CD4, Code, Age, Year, PLT, and Sex were identified in the HIV/AIDS data set. In addition, the decision rule set created can be referenced as a knowledge-based healthcare service system as the best of evidence-based practices in the workflow of current clinical diagnosis. Conclusions: This study highlights the importance of these key factors and provides the rationale that the proposed model is an effective alternative to analyzing sustained HAART medication in follow-up studies of HIV/AIDS treatment in practice. å© 2016 Elsevier Ireland Ltd.",Acquired immune deficiency syndrome (AIDS); Highly active anti-retroviral therapy (HAART); Human immunodeficiency virus (HIV); Hybrid model; Linear-nonlinear feature selection,Article,Scopus,2-s2.0-84963499962
"Chatziasimidis F., Stamelos I.",Data collection and analysis of GitHub repositories and users,2015,"IISA 2015 - 6th International Conference on Information, Intelligence, Systems and Applications",,,7388026,,,no,,,,10.1109/IISA.2015.7388026,https://www.scopus.com/inward/record.uri?eid=2-s2.0-84963857299&doi=10.1109%2fIISA.2015.7388026&partnerID=40&md5=66222e9a974ce80d622a71d0e5e0240a,"Gnomon Informatics SA, 21 Anton is Tritsis Str., Thessaloniki, Greece; Department of Informatics, Aristotle University of Thessaloniki, Thessaloniki, Greece","Chatziasimidis, F., Gnomon Informatics SA, 21 Anton is Tritsis Str., Thessaloniki, Greece; Stamelos, I., Department of Informatics, Aristotle University of Thessaloniki, Thessaloniki, Greece","In this paper, we present the collection and mining of GitHub data, aiming to understand GitHub user behavior and project success factors. We collected information about approximately 100K projects and 10K GitHub users//owners of these projects, via GitHub API. Subsequently, we statistically analyzed such data, discretized values of features via k-means algorithm, and finally we applied apriori algorithm via weka in order to find out association rules. Having assumed that project success could be measured by the cardinality of downloads we kept only the rules which had as right par a download cardinality higher than a threshold of 1000 downloads. The results provide intersting insight in the GitHub ecosystem and seven success rules for GitHub projects. å© 2015 IEEE.",association rules; discretization; GitHub; GitHub API; k-means; open source; project success,Conference Paper,Scopus,2-s2.0-84963857299
"Chandrakumar T., Parthasarathy S.",An approach to estimate the size of ERP package using package points,2016,Computer Standards and Interfaces,47,,,100,107,no,Not comparative,,1,10.1016/j.csi.2015.10.003,https://www.scopus.com/inward/record.uri?eid=2-s2.0-84963723960&doi=10.1016%2fj.csi.2015.10.003&partnerID=40&md5=b971c307c25683c4a146dc1aee0164ee,"Department of Computer Applications, Thiagarajar College of Engineering, Madurai, India","Chandrakumar, T., Department of Computer Applications, Thiagarajar College of Engineering, Madurai, India; Parthasarathy, S., Department of Computer Applications, Thiagarajar College of Engineering, Madurai, India","Enterprise Resource Planning (ERP) packages are information systems that automate the business processes of organizations thereby improving their operational efficiency substantially. ERP projects that involve customization are often affected by inaccurate estimation of efforts. Size of the software forms the basis for effort estimation. Methods used for effort estimation either employ function points (FP) or lines of code (LOC) to measure the size of customized ERP packages. Literature review reveals that the existing software size methods which are meant for custom-built software products may not be suitable for COTS products such as customized ERP packages. Hence, the effort estimation using conventional methods for customized ERP packages may not be accurate. This paper proposes a new approach to estimate the size of customized ERP packages using Package Points (PP). The proposed approach was validated with data collected from 14 ERP projects delivered by the same company. A positive correlation was observed between Package Points (PP) and the efforts of these projects. This result indicates the feasibility of our proposed approach as well as the positive climate for its utility by the project managers of future ERP projects. Lastly, we examine the implication of these results for practice and future research scope. å© 2015 Elsevier B.V. All rights reserved.",Customization; Efforts; ERP projects; Function points; Package points,Article,Scopus,2-s2.0-84963723960
"Busch A., Koziolek A.",Considering not-quantified quality attributes in an automated design space exploration,2016,"Proceedings - 2016 12th International ACM SIGSOFT Conference on Quality of Software Architectures, QoSA 2016",,,7515435,50,59,no,,,,10.1109/QoSA.2016.10,https://www.scopus.com/inward/record.uri?eid=2-s2.0-84983455304&doi=10.1109%2fQoSA.2016.10&partnerID=40&md5=eacd8395d17a69644a8cd62c72cafd45,"Karlsruhe Institute of Technology, Karlsruhe, Germany","Busch, A., Karlsruhe Institute of Technology, Karlsruhe, Germany; Koziolek, A., Karlsruhe Institute of Technology, Karlsruhe, Germany","In a software design process, the quality of the resulting software system is highly driven by the quality of its software architecture (SA). In such a process trade-off decisions must be made between multiple quality attributes (QAs), such as performance or security, that are often competing. Several approaches exist to improve SAs either quantitatively or qualitatively. The first group of approaches requires to quantify each single QA to be considered in the design process, while the latter group of approaches are often fully manual processes. However, time and cost constraints often make it impossible to either quantify all relevant QAs or manually evaluate candidate architectures. Our approach to the problem is to quantify several most important quality requirements, combine them with several not-quantified QAs and use them together in an automated design space exploration process. As our basis, we used the PerOpteryx design space exploration approach, which requires quantified measures for its optimization engine, and extended it in order to combine them with not-quantified QAs. By this, our approach allows optimizing the design space by considering even QAs that can not be quantified due to cost constraints or lack of quantification methodologies. We applied our approach to two case studies to demonstrate its benefits. We showed how performance can be balanced against not-quantified QAs, such as security, using an example derived from an industry case study. å© 2016 IEEE.",Architecture; Automated; Decision; Design; Not-Quantified; Requirements; Trade-off,Conference Paper,Scopus,2-s2.0-84983455304
"Buciakowski M., Puig V.",Guaranteed cost estimation and control for nonlinear system using LMI optimization,2016,"2016 21st International Conference on Methods and Models in Automation and Robotics, MMAR 2016",,,7575311,1211,1216,no,,,,10.1109/MMAR.2016.7575311,https://www.scopus.com/inward/record.uri?eid=2-s2.0-84991824672&doi=10.1109%2fMMAR.2016.7575311&partnerID=40&md5=3962ea32f714f47adffba87c9bd0800c,"Institute of Control and Computation Engineering, University of Zielona GÌ_ra, ul. PodgÌ_rna 50, Zielona GÌ_ra, Poland; Automatic Control Department, Universidad PolitÌ©cnica de CataluÌ±a, Rambla Sant Nebridi, 10, Terrassa, Spain","Buciakowski, M., Institute of Control and Computation Engineering, University of Zielona GÌ_ra, ul. PodgÌ_rna 50, Zielona GÌ_ra, Poland; Puig, V., Automatic Control Department, Universidad PolitÌ©cnica de CataluÌ±a, Rambla Sant Nebridi, 10, Terrassa, Spain","In the paper, a methodology for the guaranteed cost estimation and control for nonlinear system discrete-time systems is proposed. To solve such a challenging problem, the article starts with a general description of the system and assumptions regarding its nonlinearities. The subsequent part of the paper describes the design methodology of the robust observer and controller for the predefined cost function using linear matrix inequalities. The final part of the paper presents an illustrative example oriented towards a practical application to the multiple tank system, which illustrates the performance of the proposed approach. å© 2016 IEEE.",,Conference Paper,Scopus,2-s2.0-84991824672
Breskovic D.,Real options analysis for HetNet and WLAN based FiWi access networks deployment,2016,"2016 24th International Conference on Software, Telecommunications and Computer Networks, SoftCOM 2016",,,7772175,,,no,,,,10.1109/SOFTCOM.2016.7772175,https://www.scopus.com/inward/record.uri?eid=2-s2.0-85010426972&doi=10.1109%2fSOFTCOM.2016.7772175&partnerID=40&md5=3d6aab16b5ae11052a4421532f18f9c8,"Ericsson Nikola Tesla, Split, Croatia","Breskovic, D., Ericsson Nikola Tesla, Split, Croatia","Hybrid optical-wireless (FiWi) access networks prove to be a competitive solution for smart access networks as they provide broadband services to the users while maintaining lower CAPEX cost. Thorough techno-economic analysis of FiWi access network based on new technologies are needed in order to support the project planning. In this paper we present the techno-economic analysis of FiWi networks comprising the GPON and HetNet/WLAN segments. First the NPV calculation is performed based on real-life scenario. After that real options analysis is conducted in order to include uncertainties and flexibility into the project planning. Based on the obtained results the conclusions on network planning using HetNet/WLAN technologies have been drawn. å© 2016 University of Split, FESB.",access networks; CAPEX; cost estimation; FiWi; GPON; HetNet; Hybrid optical-wireless; NPV; Real options analysis; WLAN,Conference Paper,Scopus,2-s2.0-85010426972
"Bougoudis I., Demertzis K., Iliadis L.",Fast and low cost prediction of extreme air pollution values with hybrid unsupervised learning,2016,Integrated Computer-Aided Engineering,23,2,,115,127,no,,,1,10.3233/ICA-150505,https://www.scopus.com/inward/record.uri?eid=2-s2.0-84960949985&doi=10.3233%2fICA-150505&partnerID=40&md5=5058b2bc7ffc793d27d0af1389580678,"Department of Forestry and Management of the Environment and Natural Resources, Democritus University of Thrace, 193 Pandazidou st., N Orestiada, Greece","Bougoudis, I., Department of Forestry and Management of the Environment and Natural Resources, Democritus University of Thrace, 193 Pandazidou st., N Orestiada, Greece; Demertzis, K., Department of Forestry and Management of the Environment and Natural Resources, Democritus University of Thrace, 193 Pandazidou st., N Orestiada, Greece; Iliadis, L., Department of Forestry and Management of the Environment and Natural Resources, Democritus University of Thrace, 193 Pandazidou st., N Orestiada, Greece","Air pollution is the problem of adding harmful substances or other agents into the atmosphere and it is caused by industrial, transport or household activities. It is one of the most serious problems of our times and the determination of the conditions under which we have extreme pollutants' values is a crucial challenge for the modern scientific community. The innovative and effective hybrid algorithm designed and employed in this research effort is entitled Easy Hybrid Forecasting (EHF). The main advantage of the EHF is that each forecasting does not require measurements from sensors, other hardware devices or data that require the use of expensive software. This was done intentionally because the motivation for this work was the development of a hybrid application that can be downloaded for free and used easily by everyday common people with no additional financial cost, running in devices like smart phones. From this point of view it does not require data from sensors or specialized software and it can offer people reliable information about extreme cases. å© 2016 - IOS Press and the author(s). All rights reserved.",Air pollution; Feature selection; Feed forward neural networks; Fuzzy C-means; Neural gas; Random forest; Self-organizing maps,Conference Paper,Scopus,2-s2.0-84960949985
"Borandag E., Yucalar F., Erdogan S.Z.",A case study for the software size estimation through MK II FPA and FP methods,2016,International Journal of Computer Applications in Technology,53,4,,309,314,no,Sizing,,1,10.1504/IJCAT.2016.076777,https://www.scopus.com/inward/record.uri?eid=2-s2.0-84973345270&doi=10.1504%2fIJCAT.2016.076777&partnerID=40&md5=a2cd47d73ea3e5d15c14a05e7da3749f,"Department of Software Engineering, Celal Bayar University, Turgutlu, Manisa, Turkey; Department of Software Engineering, Maltepe University, Maltepe, Istanbul, Turkey","Borandag, E., Department of Software Engineering, Celal Bayar University, Turgutlu, Manisa, Turkey; Yucalar, F., Department of Software Engineering, Celal Bayar University, Turgutlu, Manisa, Turkey; Erdogan, S.Z., Department of Software Engineering, Maltepe University, Maltepe, Istanbul, Turkey","Software size estimation is one of the most crucial and daunting tasks for a software project manager. It is very important for the accurate planning and calculation of the software project. The importance of software size estimation becomes critical at the beginning of the software life cycle. Software size estimation is a basic input for the software effort and cost estimation. There are many different approaches and various methods for software size estimation up to now such as the function points method, e.g., IFPUG FPA, Mk II FPA, COSMIC FFP. In this paper, the size of the software project was calculated through the function points method and Mark II FPA. The same software project was implemented by different software development teams. Early estimations were performed for the software project and the data obtained as a result of the teams' studies were compared. Copyright å© 2016 Inderscience Enterprises Ltd.",Function point method; Mark II FPA; Software size estimation,Article,Scopus,2-s2.0-84973345270
"Bohlouli M., Mittas N., Kakarontzas G., Theodosiou T., Angelis L., Fathi M.",Competence assessment as an expert system for human resource management: A mathematical approach,2017,Expert Systems with Applications,70,,,83,102,no,,,,10.1016/j.eswa.2016.10.046,https://www.scopus.com/inward/record.uri?eid=2-s2.0-84996720572&doi=10.1016%2fj.eswa.2016.10.046&partnerID=40&md5=22cb0c2540ba0358aea784a997414dab,"Institute of Knowledge Based Systems, University of Siegen, Hoelderlinstr, Siegen, Germany; Department of Informatics, Aristotle University of Thessaloniki, Thessaloniki, Greece; Department of Computer Science and Engineering, T.E.I. of Thessaly, Larissa, Greece","Bohlouli, M., Institute of Knowledge Based Systems, University of Siegen, Hoelderlinstr, Siegen, Germany; Mittas, N., Department of Informatics, Aristotle University of Thessaloniki, Thessaloniki, Greece; Kakarontzas, G., Department of Informatics, Aristotle University of Thessaloniki, Thessaloniki, Greece, Department of Computer Science and Engineering, T.E.I. of Thessaly, Larissa, Greece; Theodosiou, T., Department of Informatics, Aristotle University of Thessaloniki, Thessaloniki, Greece; Angelis, L., Department of Informatics, Aristotle University of Thessaloniki, Thessaloniki, Greece; Fathi, M., Institute of Knowledge Based Systems, University of Siegen, Hoelderlinstr, Siegen, Germany","Efficient human resource management needs accurate assessment and representation of available competences as well as effective mapping of required competences for specific jobs and positions. In this regard, appropriate definition and identification of competence gaps express differences between acquired and required competences. Using a detailed quantification scheme together with a mathematical approach is a way to support accurate competence analytics, which can be applied in a wide variety of sectors and fields. This article describes the combined use of software technologies and mathematical and statistical methods for assessing and analyzing competences in human resource information systems. Based on a standard competence model, which is called a Professional, Innovative and Social competence tree, the proposed framework offers flexible tools to experts in real enterprise environments, either for evaluation of employees towards an optimal job assignment and vocational training or for recruitment processes. The system has been tested with real human resource data sets in the frame of the European project called ComProFITS. å© 2016",Competence analysis; Competence assessment; Competence reference model; Human resource information system; Mathematical representation of competences,Article,Scopus,2-s2.0-84996720572
