Authors,Document Title,Year,Source title,Volume,Issue,Art. No.,Page start,Page end,label,Other predictin,Page count,Cited by,DOI,PDF Link,Affiliations,Authors with affiliations,Abstract,Author Keywords,Document Type,Source,EID
"Sharma H.K., Tomar R., Dumka A., Aswal M.S.",OpenECOCOMO: The algorithms and implementation of Extended Cost Constructive Model (E-COCOMO),2015,"Proceedings on 2015 1st International Conference on Next Generation Computing Technologies, NGCT 2015",,,7375225,773,778,no,,,,10.1109/NGCT.2015.7375225,https://www.scopus.com/inward/record.uri?eid=2-s2.0-84964503269&doi=10.1109%2fNGCT.2015.7375225&partnerID=40&md5=bd56aee005b762158d3244a5919511b4,"Centre for Information Technology, UPES, Dehradun, India; Faculty of Engineering Technology, Gurukul Kangri University, Haridwar, India","Sharma, H.K., Centre for Information Technology, UPES, Dehradun, India; Tomar, R., Centre for Information Technology, UPES, Dehradun, India; Dumka, A., Centre for Information Technology, UPES, Dehradun, India; Aswal, M.S., Faculty of Engineering Technology, Gurukul Kangri University, Haridwar, India","Traditional software development approaches is obsoleting day by day and the place is being taken by some new evolved approaches like. Cleanroom development approach, Agile development approach etc. due to the evolution in development methodology there is a strong need of evolution in estimation models also. In this work we have proposed an extended version of COCOMO that is E-COCOMO and based on this model a tool has been implemented called OpenECOCOMO. The evolved model is proposed for the new development methodologies and includes some more factors for estimation used in these new approaches. å© 2015 IEEE.",Cleanroom Software Engineering; COCOMO; Cost Drivers; E-COCOMO; Effort Estimation; OpenECOCOMO; SDLC,Conference Paper,Scopus,2-s2.0-84964503269
"Shariat Yazdi H., Angelis L., Kehrer T., Kelter U.","A framework for capturing, statistically modeling and analyzing the evolution of software models",2016,Journal of Systems and Software,118,,,176,207,no,,,,10.1016/j.jss.2016.05.010,https://www.scopus.com/inward/record.uri?eid=2-s2.0-84969190349&doi=10.1016%2fj.jss.2016.05.010&partnerID=40&md5=b1964cd7dcad36eed7033a55fa3dc980,"Software Engineering Group, University of Siegen, Germany; Department of Informatics, Aristotle University of Thessaloniki, Greece; Department of Electronics, Informatics and Bioengineering, Politecnico di Milano, Italy","Shariat Yazdi, H., Software Engineering Group, University of Siegen, Germany; Angelis, L., Department of Informatics, Aristotle University of Thessaloniki, Greece; Kehrer, T., Software Engineering Group, University of Siegen, Germany, Department of Electronics, Informatics and Bioengineering, Politecnico di Milano, Italy; Kelter, U., Software Engineering Group, University of Siegen, Germany","This paper presents a new methodological framework for capturing and statistically modeling the evolution of models in model-driven software development. The framework captures the changes between revisions of models in terms of both low-level (internal) and high-level (developer-visible) edit operations applied between revisions. In our approach, evolution is modeled statistically by using ARMA, GARCH and mixed ARMA-GARCH models. Forecasting and simulation aspects of these time series models are thoroughly assessed. The suitability of the framework is shown by applying it to a large set of design models of real Java systems. Our analysis shows that mixed ARMA-GARCH models are superior to ARMA models. A main motivation for, and application of, the resulting statistical models is to control the generation of realistic model histories which are intended to be used for testing model versioning tools. We present the architecture of the model generator and show how to generate random sequences from the statistical models which control the generation process. Further usages of the statistical models include various forecasting and simulation tasks. å© 2016 Elsevier Inc. All rights reserved.",Forecasting; Model driven engineering; Simulation; Software model evolution analysis; Test model generation; Time series analysis,Article,Scopus,2-s2.0-84969190349
"Shao Y., Heath T., Zhu Y.",Developing an economic estimation system for vertical farms,2016,International Journal of Agricultural and Environmental Information Systems,7,2,,26,51,no,,,,10.4018/IJAEIS.2016040102,https://www.scopus.com/inward/record.uri?eid=2-s2.0-84978219447&doi=10.4018%2fIJAEIS.2016040102&partnerID=40&md5=b0c84ea903b28ca9d12953440dcbd03f,"University of Nottingham, Nottingham, United Kingdom; Department of Architecture and Urban Design, University of Nottingham, Nottingham, United Kingdom; Department of Architecture and Built Environment, University of Nottingham, Nottingham, United Kingdom","Shao, Y., University of Nottingham, Nottingham, United Kingdom; Heath, T., Department of Architecture and Urban Design, University of Nottingham, Nottingham, United Kingdom; Zhu, Y., Department of Architecture and Urban Design, University of Nottingham, Nottingham, United Kingdom, Department of Architecture and Built Environment, University of Nottingham, Nottingham, United Kingdom","The concept of vertical farming is nearly twenty years old, however, there are only a few experimental prototypes despite its many advantages compared to conventional agriculture. Significantly, financial uncertainty has been identified as the largest barrier to the realization of a 'real' vertical farm. Some specialists have provided ways to calculate costs and return on investment, however, most of them are superficial with calculations based on particular contextual circumstances. To move the concept forwards a reliable and flexible estimating tool, specific to this new building typology, is clearly required. A computational system, software named VFer, has therefore been developed by the authors to provide such a solution. This paper examines this highly flexible, customised system and results from several typical vertical farm configurations in three mega-cities (Shanghai, London and Washington DC) are used to elucidate the potential economic return of vertical farms. å© Copyright 2016, IGI Global.",Agricultural economics; Agricultural information system; Cost modeling methodology; Financial analysis; Greenhouse; Hydroponics; Simulator; Urban agriculture; Vertical farming,Article,Scopus,2-s2.0-84978219447
"Sgroi M.F., Zedde F., Barbera O., Stassi A., SebastiÌÁn D., Lufrano F., Baglio V., AricÌ_ A.S., Bonde J.L., Schuster M.",Cost analysis of direct methanol fuel cell stacks for mass production,2016,Energies,9,12,1008,,,no,,,,10.3390/en9121008,https://www.scopus.com/inward/record.uri?eid=2-s2.0-85002951667&doi=10.3390%2fen9121008&partnerID=40&md5=93c65aa242356e3c8d155549e9afed05,"Centro Ricerche FIAT S.C.p.A., Strada Torino 50, Orbassano, Italy; CNR-ITAE, Via Salita S. Lucia sopra Contesse 5, Messina, Italy; IRD, A/S Emil Neckelmanns vej 15 A and B, Odense SÌ÷, Denmark; FUMATECH BWT GmbH, Carl-Benz-Strasse 4, Bietigheim-Bissingen, Germany","Sgroi, M.F., Centro Ricerche FIAT S.C.p.A., Strada Torino 50, Orbassano, Italy; Zedde, F., Centro Ricerche FIAT S.C.p.A., Strada Torino 50, Orbassano, Italy; Barbera, O., CNR-ITAE, Via Salita S. Lucia sopra Contesse 5, Messina, Italy; Stassi, A., CNR-ITAE, Via Salita S. Lucia sopra Contesse 5, Messina, Italy; SebastiÌÁn, D., CNR-ITAE, Via Salita S. Lucia sopra Contesse 5, Messina, Italy; Lufrano, F., CNR-ITAE, Via Salita S. Lucia sopra Contesse 5, Messina, Italy; Baglio, V., CNR-ITAE, Via Salita S. Lucia sopra Contesse 5, Messina, Italy; AricÌ_, A.S., CNR-ITAE, Via Salita S. Lucia sopra Contesse 5, Messina, Italy; Bonde, J.L., IRD, A/S Emil Neckelmanns vej 15 A and B, Odense SÌ÷, Denmark; Schuster, M., FUMATECH BWT GmbH, Carl-Benz-Strasse 4, Bietigheim-Bissingen, Germany","Fuel cells are very promising technologies for efficient electrical energy generation. The development of enhanced system components and new engineering solutions is fundamental for the large-scale deployment of these devices. Besides automotive and stationary applications, fuel cells can be widely used as auxiliary power units (APUs). The concept of a direct methanol fuel cell (DMFC) is based on the direct feed of a methanol solution to the fuel cell anode, thus simplifying safety, delivery, and fuel distribution issues typical of conventional hydrogen-fed polymer electrolyte fuel cells (PEMFCs). In order to evaluate the feasibility of concrete application of DMFC devices, a cost analysis study was carried out in the present work. A 200 W-prototype developed in the framework of a European Project (DURAMET) was selected as the model system. The DMFC stack had a modular structure allowing for a detailed evaluation of cost characteristics related to the specific components. A scale-down approach, focusing on the model device and projected to a mass production, was used. The data used in this analysis were obtained both from research laboratories and industry suppliers specialising in the manufacturing/production of specific stack components. This study demonstrates that mass production can give a concrete perspective for the large-scale diffusion of DMFCs as APUs. The results show that the cost derived for the DMFC stack is relatively close to that of competing technologies and that the introduction of innovative approaches can result in further cost savings. å© 2016 by the authors; licensee MDPI.",Catalysts; Cost analysis; Direct methanol fuel cell (DMFC); Membranes; Stack,Article,Scopus,2-s2.0-85002951667
"Schwartz A., Do H.",Cost-effective regression testing through Adaptive Test Prioritization strategies,2016,Journal of Systems and Software,115,,,61,81,no,,,,10.1016/j.jss.2016.01.018,https://www.scopus.com/inward/record.uri?eid=2-s2.0-84960881560&doi=10.1016%2fj.jss.2016.01.018&partnerID=40&md5=9b0cfcfba1c7ed8b6ab89a52e5660c8c,"University of South Carolina Upstate, Chesnee, SC, United States; University of North Texas, Denton, TX, United States","Schwartz, A., University of South Carolina Upstate, Chesnee, SC, United States; Do, H., University of North Texas, Denton, TX, United States","Regression testing is an important part of the software development life cycle. It is also very expensive. Many different techniques have been proposed for reducing the cost of regression testing. However, research has shown that the effectiveness of different techniques varies under different testing environments and software change characteristics. In prior work, we developed strategies to investigate ways of choosing the most cost-effective regression testing technique for a particular regression testing session. In this work, we empirically study the existing strategies presented in prior work as well as develop two additional Adaptive Test Prioritization (ATP) strategies using fuzzy analytical hierarchy process (AHP) and the weighted sum model (WSM). We also provide a comparative study examining each of the ATP strategies presented to date. This research will provide researchers and practitioners with strategies to utilize in regression testing plans as well as provide data to use when deciding which of the strategies would best fit their testing needs. The empirical studies provided in this research show that utilizing these strategies can improve the cost-effectiveness of regression testing. å© 2016 Elsevier Inc. All rights reserved.",Adaptive regression testing strategy; Regression testing; Test case prioritization,Article,Scopus,2-s2.0-84960881560
"Schultheiss F., HÌ_gglund S., StÌ´hl J.-E.",Modeling the cost of varying surface finish demands during longitudinal turning operations,2016,International Journal of Advanced Manufacturing Technology,84,5-Aug,,1103,1114,no,,,,10.1007/s00170-015-7750-6,https://www.scopus.com/inward/record.uri?eid=2-s2.0-84941367056&doi=10.1007%2fs00170-015-7750-6&partnerID=40&md5=03325e6165d4e69641b8b31f8ff5f74a,"Division of Production and Materials Engineering, Lund University, Lund, Sweden; Seco Tools AB, Fagersta, Sweden","Schultheiss, F., Division of Production and Materials Engineering, Lund University, Lund, Sweden; HÌ_gglund, S., Seco Tools AB, Fagersta, Sweden; StÌ´hl, J.-E., Division of Production and Materials Engineering, Lund University, Lund, Sweden","Tolerances, including geometry, dimension, and surface roughness, are an important part of production where the desire to manufacture quality products have to be weighed against the increase of manufacturing costs. The desired tolerance will influence the choice of both manufacturing method and machine tool. Given that machining is an adequate production method, variation of the required tolerances will imply a variation of the part cost which needs to be taken into account during production planning. Thus, the term ‰ÛÏtolerance cost‰Û is introduced. The paper presents a model for evaluating the tolerance cost in respect to the surface roughness during longitudinal turning operations, enabling a better comparison between different production alternatives. Through knowledge of the required surface roughness, it is possible to estimate appropriate cutting conditions. Knowledge of the cutting conditions and the part geometry then makes it possible to calculate the cycle time, information which in turn may be used for calculating the corresponding part cost. Through using experimental data, it is proven that the required surface roughness has a significant influence on the attained manufacturing cost. For instance, while longitudinally turning AISI 4140, it was shown that an improvement of the surface roughness from Ra = 3.2åÊë_m to Ra = 1.6åÊë_m will entail an increase of the part cost by roughly 20åÊ%. Similarly, a decrease of the required surface quality (larger Ra value) will imply a significantly reduced part cost. å© 2015, Springer-Verlag London.",Machining; Part cost; Surface roughness; Turning,Article,Scopus,2-s2.0-84941367056
"Scholtes I., Mavrodiev P., Schweitzer F.",From Aristotle to Ringelmann: a large-scale analysis of team productivity and coordination in Open Source Software projects,2016,Empirical Software Engineering,21,2,,642,683,no,,,,10.1007/s10664-015-9406-4,https://www.scopus.com/inward/record.uri?eid=2-s2.0-84950257604&doi=10.1007%2fs10664-015-9406-4&partnerID=40&md5=2b9f96df7857068da67b680731155cf5,"ETH ZÌ_rich, Chair of Systems Design, Weinbergstrasse 56/58, Zurich, Switzerland","Scholtes, I., ETH ZÌ_rich, Chair of Systems Design, Weinbergstrasse 56/58, Zurich, Switzerland; Mavrodiev, P., ETH ZÌ_rich, Chair of Systems Design, Weinbergstrasse 56/58, Zurich, Switzerland; Schweitzer, F., ETH ZÌ_rich, Chair of Systems Design, Weinbergstrasse 56/58, Zurich, Switzerland","Complex software development projects rely on the contribution of teams of developers, who are required to collaborate and coordinate their efforts. The productivity of such development teams, i.e., how their size is related to the produced output, is an important consideration for project and schedule management as well as for cost estimation. The majority of studies in empirical software engineering suggest that - due to coordination overhead - teams of collaborating developers become less productive as they grow in size. This phenomenon is commonly paraphrased as Brooks‰Ûª law of software project management, which states that ‰ÛÏadding manpower to a software project makes it later‰Û. Outside software engineering, the non-additive scaling of productivity in teams is often referred to as the Ringelmann effect, which is studied extensively in social psychology and organizational theory. Conversely, a recent study suggested that in Open Source Software (OSS) projects, the productivity of developers increases as the team grows in size. Attributing it to collective synergetic effects, this surprising finding was linked to the Aristotelian quote that ‰ÛÏthe whole is more than the sum of its parts‰Û. Using a data set of 58 OSS projects with more than 580,000 commits contributed by more than 30,000 developers, in this article we provide a large-scale analysis of the relation between size and productivity of software development teams. Our findings confirm the negative relation between team size and productivity previously suggested by empirical software engineering research, thus providing quantitative evidence for the presence of a strong Ringelmann effect. Using fine-grained data on the association between developers and source code files, we investigate possible explanations for the observed relations between team size and productivity. In particular, we take a network perspective on developer-code associations in software development teams and show that the magnitude of the decrease in productivity is likely to be related to the growth dynamics of co-editing networks which can be interpreted as a first-order approximation of coordination requirements. å© 2015, Springer Science+Business Media New York.",Coordination; Open source software; Productivity factors; Repository mining; Social aspects of software engineering; Software engineering,Article,Scopus,2-s2.0-84950257604
"Schmitz B., Duffort F., Satzger G.",Managing Uncertainty in Industrial Full Service Contracts: Digital Support for Design and Delivery,2016,Proceedings - CBI 2016: 18th IEEE Conference on Business Informatics,1,,7780307,123,132,no,,,,10.1109/CBI.2016.22,https://www.scopus.com/inward/record.uri?eid=2-s2.0-85010441758&doi=10.1109%2fCBI.2016.22&partnerID=40&md5=4f5986d535d776d6cd4f882b9517b0ff,"Karlsruhe Service Research Institute, Karlsruhe Institute of Technology, Karlsruhe, Germany","Schmitz, B., Karlsruhe Service Research Institute, Karlsruhe Institute of Technology, Karlsruhe, Germany; Duffort, F., Karlsruhe Service Research Institute, Karlsruhe Institute of Technology, Karlsruhe, Germany; Satzger, G., Karlsruhe Service Research Institute, Karlsruhe Institute of Technology, Karlsruhe, Germany","In industrial maintenance, the backbone of the industrial service business, full-service contracts form new and increasingly popular value propositions. For operators of industrial equipment these contracts offer peace of mind at a fixed price, as service providers bear the cost for any action required to maintain or repair their clients' equipment after (unexpected) failures. In order to ensure profitable offers, providers require methods to both assess uncertainties in the contract design phase and to reduce their adverse business impact during service delivery. So far, research has primarily focused on the identification of uncertainties for various types of contracts. There has been a lack of focus, though, on how digital technologies can support a risk-based design of service contracts - either by reducing uncertainties (e.g. by employing technologies for data collection) or by mitigating their business impact (e.g. by reacting more effectively to unexpected events during service delivery). We address this research gap by elaborating on the interdependencies between uncertainties, their adverse business impact and measures to mitigate this impact. We portray the current state of the art in uncertainty management based on a literature review and complement these results with findings from exploratory interviews with experts of full-service providers in the industrial sector. Building upon the results, we discuss how digital technologies can improve uncertainty management in full-service maintenance contracts and, more generally, in service contracts overall. å© 2016 IEEE.",contract design; industrial service contracts; risk management; uncertainy management,Conference Paper,Scopus,2-s2.0-85010441758
"Sandberg M., Tyapin I., Kokkolaras M., Lundbladh A., Isaksson O.",A knowledge-based master model approach exemplified with jet engine structural design,2017,Computers in Industry,85,,,31,38,no,,,,10.1016/j.compind.2016.12.003,https://www.scopus.com/inward/record.uri?eid=2-s2.0-85007480242&doi=10.1016%2fj.compind.2016.12.003&partnerID=40&md5=708def428201fcf3c3b01694ace7ccbd,"LuleÌ´ University of Technology, LuleÌ´, Sweden; University of Agder, Kristiansand, Norway; McGill University, Montreal, Canada; GKN Aerospace, TrollhÌ_ttan, Sweden; Chalmers University of Technology, GÌ¦teborg, Sweden","Sandberg, M., LuleÌ´ University of Technology, LuleÌ´, Sweden; Tyapin, I., University of Agder, Kristiansand, Norway; Kokkolaras, M., McGill University, Montreal, Canada; Lundbladh, A., GKN Aerospace, TrollhÌ_ttan, Sweden; Isaksson, O., GKN Aerospace, TrollhÌ_ttan, Sweden, Chalmers University of Technology, GÌ¦teborg, Sweden","Successful product development requires the consideration of multiple engineering disciplines and the quantification of tradeoffs among conflicting objectives from the very early design phases. The single-largest challenge to do so is the lack of detailed design information. A possible remedy of this issue is knowledge-based engineering. This paper presents a knowledge-based master model approach that enables the management of concurrent design and analysis models within different engineering disciplines in relation to the same governing product definition. The approach is exemplified on an early phase structural design of a turbo-fan jet engine. The model allows geometric-, structural mechanics- and rotor-dynamic- models to be concurrently integrated into a multi-disciplinary design and optimization loop. å© 2016 Elsevier B.V.",Jet engine; Knowledge-based engineering; Master model; Multidisciplinary analysis and design,Article,Scopus,2-s2.0-85007480242
"Salmi A., David P., Blanco E., Summers J.D.",A review of cost estimation models for determining assembly automation level,2016,Computers and Industrial Engineering,98,,,246,259,no,,,,10.1016/j.cie.2016.06.007,https://www.scopus.com/inward/record.uri?eid=2-s2.0-84974712811&doi=10.1016%2fj.cie.2016.06.007&partnerID=40&md5=80efc717b01e2f59d13353bdc0e5299b,"Univ. Grenoble Alpes, G-SCOP Laboratory, 46 Avenue Flix Viallet, Grenoble, France; CNRS, G-SCOP, Grenoble, France; Department of Mechanical Engineering, Clemson UniversitySC, United States","Salmi, A., Univ. Grenoble Alpes, G-SCOP Laboratory, 46 Avenue Flix Viallet, Grenoble, France, CNRS, G-SCOP, Grenoble, France; David, P., Univ. Grenoble Alpes, G-SCOP Laboratory, 46 Avenue Flix Viallet, Grenoble, France, CNRS, G-SCOP, Grenoble, France; Blanco, E., Univ. Grenoble Alpes, G-SCOP Laboratory, 46 Avenue Flix Viallet, Grenoble, France, CNRS, G-SCOP, Grenoble, France; Summers, J.D., Department of Mechanical Engineering, Clemson UniversitySC, United States","The aim of this research is to support early phase cost estimation for assembly systems design and automation decision. During this phase, various alternatives of assembly systems with different automation levels can be generated. The alternatives generation is performed using available information on product design, assembly sequences, and planned production information. The issue is to assess given alternatives, identify, and opt for the most appropriate one. Several criteria have to be considered in this decision. The economic aspect represents one of the most preponderant, including cost and profitability prediction. The importance and challenges of this complex issue are highlighted in this paper with feedbacks from manufacturers and the literature. The literature in the field is reviewed, presented, and analyzed. For this sake, a selection of cost models is performed covering a wide chronological range, journals, and fields including assembly and manufacturing models. Classification techniques of cost estimation works are presented and exploited in the proposed review. It is used to filter and discuss models suitability for the defined assembly automation decision issue. The most appropriate models are more thoroughly reviewed and discussed. Useful literature costing techniques, features, and relevant cost drivers are also identified. They cover multiple aspects as production information, resources features or performances. Finally, the review findings are illustrated by a cost estimation outline proposal to support early phase cost prediction for assembly systems design and automation decision. å© 2016 Elsevier Ltd.",Assembly; Cost estimation; Economic model; Level of automation; Systems design,Review,Scopus,2-s2.0-84974712811
